{
  "$schema": "https://json-schema.org/draft/2020-12/schema",
  "title": "Unsupported claims in a job-specific resume (08-ats/jobs/<slug>/flags.json)",
  "type": "array",
  "items": {
    "type": "object",
    "required": ["bullet_id", "text", "text_sha256", "reasons"],
    "additionalProperties": false,
    "properties": {
      "bullet_id": {"type": "string", "pattern": "^b_[A-Za-z0-9_-]+$"},
      "text": {"type": "string", "minLength": 1},
      "text_sha256": {"type": "string", "pattern": "^[0-9a-f]{64}$"},
      "reasons": {"type": "array", "minItems": 1, "items": {"type": "string"}}
    }
  }
}
